{
  "$schema": "https://json-schema.org/draft/2020-12/schema",
  "title": "AskQuran Variant Map v1",
  "type": "object",
  "required": [
    "schema",
    "version",
    "created_at_utc",
    "source",
    "variants"
  ],
  "properties": {
    "schema": {
      "const": "askquran_variant_map_v1"
    },
    "version": {
      "type": "integer"
    },
    "created_at_utc": {
      "type": "string"
    },
    "source": {
      "type": "object"
    },
    "variants": {
      "type": "object",
      "additionalProperties": {
        "type": "array",
        "items": {
          "type": "string"
        }
      }
    }
  },
  "additionalProperties": true
}
